1,2,3
(Python) How to find the index of the maximum value of a list,,
Locate the index of largest value in an array python,,
How to find all positions of the maximum value in a list?,,
find the maximum number in a list using a loop,,
Python: get value from row and column from a matrix,,
"In Python, how can I get the indices of the 5 greatest values of a list?",,
Iterating through a list or a list of lists and replacing specific elements in the list of lists,,
Stackoverflow Related questions algorithm,,
NLP: any easy and good methods to find semantic similarity between words?,,
Measuring semantic similarity between two phrases,,
Calculating the semantic distance between words,,
What are some good methods to find the “relatedness” of two bodies of text?,,
How do I calculate the shortest path (geodesic) distance between two adjectives in WordNet using Python NLTK?,,
Detecting Similarity in Strings,,
Find semantic similarity between two phrases,,
Is there an algorithm that tells the semantic similarity of two phrases,,
Natural language processing: finding semantic similarities with standard algorithms?,,
Rewriting sentences while retaining semantic meaning,,
Finding semantic similarity and relations between different words,,
measure of semantic similarity of 2 sentence,,
How to get semantic type of a word?,,
Why is Leacock distance measure normalized with total taxonomy depth,,
Siri-like app: calculating similarities between a query and a predefined set of control phrases,,
Find semantic similarity between two phrases,,
Pythonic way to find maximum value and its index in a list?,,
Best way to check if a list is empty,,
Finding the index of an item given a list containing it in Python,,
How do you split a list into evenly sized chunks?,,
Python join: why is it string.join(list) instead of list.join(string)?,,
How to remove an element from a list by index in Python?,,
Getting the last element of a list in Python,,
Making a flat list out of list of lists in Python,,
How to get the size of a list,,
How to append list to second list (concatenate lists),,
How to clone or copy a list?,,
Best way to check if a list is empty,,
What is the most efficient way to deep clone an object in JavaScript?,,
How do I copy a file in python?,,
How do I clone a generic list in C#?,,
How do you split a list into evenly sized chunks?,,
How do I copy an object in Java?,,
How to get the size of a list,,
How to append list to second list (concatenate lists),,
Clone/Copy unmodifable list,,
Sorting dictionary keys in python,,
sort values and return list of keys from dict python,,
Python: How to sort a dictionary by key,,
Sort dict by highest value?,,
Sort Python dict by datetime value,,
"Sort dict by value and return dict, not list of tuples",,
sort list by frequency-value in python,,
Sorting a dictionary in python,,
How to use the dictionary function?,,
Python: sort dictionary with tuples as key by the value,,
How do you sort a dictionary by value?,,
How to merge two Python dictionaries in a single expression?,,
How do I sort a list of dictionaries by values of the dictionary in Python?,,
"Sort a Map<Key, Value> by values (Java)",,
Add new keys to a dictionary?,,
Sort array of objects by string property value in JavaScript,,
Check if a given key already exists in a dictionary,,
Iterating over dictionaries using 'for' loops,,
python dictionary values sorting,,
How can I sort a dictionary by key?,,
